<?xml version="1.0" encoding="UTF-8"?>
<?xml-stylesheet type="text/css" href="moviesStylesheet.css"?>



<filmy xmlns="http://www.example.org/typy" xmlns:xsi="http://www.w3.org/2001/XMLSchema-instance" xsi:schemaLocation="http://www.example.org/typy movies.xsd">
    <metadane>
        <autorzy>
        <autor>Piotr Rokicki</autor>
        <autor>Filip Łuczak</autor>
        </autorzy>
        <wersja>2.0</wersja>
        <opis>Ranking filmów kinowych według serwisu Filmweb</opis>
    </metadane>
    <film studio = "twentieth">
        <tytuł>Skazani na Shawshank</tytuł>
        <reżyser>Frank Darabont</reżyser>
        <data_premiery>1995-04-16</data_premiery>
        <aktorzy>
            <aktor filmweb="http://www.filmweb.pl/person/Tim.Robbins">
                <imię>Tim</imię>
                <nazwisko>Robbibs</nazwisko>
            </aktor>
            <aktor filmweb="http://www.filmweb.pl/person/Morgan.Freeman">
                <imię>Morgan</imię>
                <nazwisko>Freeman</nazwisko>
            </aktor>
            <aktor>
                <imię>Bob</imię>
                <nazwisko>Gunton</nazwisko>
            </aktor>
        </aktorzy>
        <gatunek GATUNEK="Dramat"/>
        <box_office waluta="Dolarów">59841469</box_office>
        <ograniczenie_wiekowe od_lat="od_szesnastu_lat"/>
    </film>
    <film studio = "twentieth">
        <tytuł>Nietykalni</tytuł>
        <reżyser>Olivier Nakache</reżyser>
        <reżyser>Eric Toledano</reżyser>
        <data_premiery>2012-04-13</data_premiery>
        <aktorzy>
            <aktor>
                <imię>Francois</imię>
                <nazwisko>Cluzet</nazwisko>
            </aktor>
            <aktor>
                <imię>Omar</imię>
                <nazwisko>Sy</nazwisko>
            </aktor>
        </aktorzy>
        <gatunek GATUNEK="Komedia"/>
        <box_office waluta="Dolarów">426588510</box_office>
        <ograniczenie_wiekowe od_lat="od_trzynastu_lat"/>
    </film>
    <film studio = "twentieth">
        <tytuł>Zielona mila</tytuł>
        <reżyser>Frank Darabont</reżyser>
        <data_premiery>2000-03-24</data_premiery>
        <aktorzy>
            <aktor>
                <imię>Tom</imię>
                <nazwisko>Hanks</nazwisko>
            </aktor>
            <aktor>
                <imię>David</imię>
                <nazwisko>Morse</nazwisko>
            </aktor>
            <aktor>
                <imię>Bonnie</imię>
                <nazwisko>Hunt</nazwisko>
            </aktor>
            <aktor>
                <imię>Michael</imię>
                <nazwisko>Clarke Duncan</nazwisko>
            </aktor>
        </aktorzy>
        <gatunek GATUNEK="Dramat"/>
        <box_office waluta="Dolarów">286801374</box_office>
        <ograniczenie_wiekowe od_lat="od_szesnastu_lat"/>
    </film>
    <film studio = "twentieth">
        <tytuł>Ojciec chrzestny</tytuł>
        <reżyser>Francis Ford Coppola</reżyser>
        <data_premiery>1972-12-31</data_premiery>
        <aktorzy>
            <aktor>
                <imię>Marlon</imię>
                <nazwisko>Brando</nazwisko>
            </aktor>
            <aktor>
                <imię>Al</imię>
                <nazwisko>Pacino</nazwisko>
            </aktor>
            <aktor>
                <imię>James</imię>
                <nazwisko>Caan</nazwisko>
            </aktor>
            <aktor>
                <imię>Richard</imię>
                <nazwisko>Castellano</nazwisko>
            </aktor>
            <aktor>
                <imię>Robert</imię>
                <nazwisko>Duvall</nazwisko>
            </aktor>
        </aktorzy>
        <gatunek GATUNEK="Dramat"/>
        <box_office waluta="Dolarów">245066411</box_office>
        <ograniczenie_wiekowe od_lat="od_szesnastu_lat"/>
    </film>
    <film studio = "twentieth">
        <tytuł>Dwunastu gniewnych ludzi</tytuł>
        <reżyser>Sidney Lumet</reżyser>
        <data_premiery>1959-11-01</data_premiery>
        <aktorzy>
            <aktor>
                <imię>Martin</imię>
                <nazwisko>Balsam</nazwisko>
            </aktor>
            <aktor>
                <imię>John</imię>
                <nazwisko>Fiedler</nazwisko>
            </aktor>
            <aktor>
                <imię>Jack</imię>
                <nazwisko>Klugman</nazwisko>
            </aktor>
        </aktorzy>
        <gatunek GATUNEK="Dramat"/>
        <ograniczenie_wiekowe od_lat="od_trzynastu_lat"/>
    </film>
    <film studio = "twentieth">
        <tytuł>Forrest Gump</tytuł>
        <reżyser>Robert Zemeckis</reżyser>
        <data_premiery>1994-11-04</data_premiery>
        <aktorzy>
            <aktor>
                <imię>Tom</imię>
                <nazwisko>Hanks</nazwisko>
            </aktor>
            <aktor>
                <imię>Robin</imię>
                <nazwisko>Wright</nazwisko>
            </aktor>
            <aktor>
                <imię>Gary</imię>
                <nazwisko>Sinise</nazwisko>
            </aktor>
        </aktorzy>
        <gatunek GATUNEK="Dramat"/>
        <box_office waluta="Dolarów">677387716</box_office>
        <ograniczenie_wiekowe od_lat="od_trzynastu_lat"/>
    </film>
    <film studio = "PIXAR">
        <tytuł>Lot nad kukułczym gniazdem</tytuł>
        <reżyser>Miloš Forman</reżyser>
        <data_premiery>1975-12-31</data_premiery>
        <aktorzy>
            <aktor>
                <imię>Jack</imię>
                <nazwisko>Nicholson</nazwisko>
            </aktor>
            <aktor>
                <imię>Louise</imię>
                <nazwisko>Fletcher</nazwisko>
            </aktor>
            <aktor>
                <imię>Michael</imię>
                <nazwisko>Berryman</nazwisko>
            </aktor>
            <aktor>
                <imię>Danny</imię>
                <nazwisko>DeVito</nazwisko>
            </aktor>
        </aktorzy>
        <gatunek GATUNEK="Dramat"/>
        <ograniczenie_wiekowe od_lat="od_szesnastu_lat"/>
    </film>
    <film studio = "twentieth">
        <tytuł>Ojciec chrzestny II</tytuł>
        <reżyser>Francis Ford Coppola</reżyser>
        <data_premiery>1974-12-12</data_premiery>
        <aktorzy>
            <aktor>
                <imię>Al</imię>
                <nazwisko>Pacino</nazwisko>
            </aktor>
            <aktor>
                <imię>Robert</imię>
                <nazwisko>Duvall</nazwisko>
            </aktor>
            <aktor>
                <imię>Diane</imię>
                <nazwisko>Keaton</nazwisko>
            </aktor>
            <aktor>
                <imię>Robert</imię>
                <nazwisko>De Niro</nazwisko>
            </aktor>
        </aktorzy>
        <gatunek GATUNEK="Dramat"/>
        <box_office waluta="Dolarów">193000000</box_office>
        <ograniczenie_wiekowe od_lat="od_szesnastu_lat"/>
    </film>
    <film studio = "twentieth">
        <tytuł>Władca Pierścieni: Powrót króla</tytuł>
        <reżyser>Peter Jackson</reżyser>
        <data_premiery>2004-01-01</data_premiery>
        <aktorzy>
            <aktor>
                <imię>Elijah</imię>
                <nazwisko>Wood</nazwisko>
            </aktor>
            <aktor>
                <imię>Sean</imię>
                <nazwisko>Astin</nazwisko>
            </aktor>
            <aktor>
                <imię>Dominic</imię>
                <nazwisko>Monaghan</nazwisko>
            </aktor>
            <aktor>
                <imię>Billy</imię>
                <nazwisko>Boyd</nazwisko>
            </aktor>
            <aktor>
                <imię>Viggo</imię>
                <nazwisko>Mortensen</nazwisko>
            </aktor>
            <aktor>
                <imię>Ian</imię>
                <nazwisko>McKellen</nazwisko>
            </aktor>
            <aktor>
                <imię>Liv</imię>
                <nazwisko>Tyler</nazwisko>
            </aktor>
            <aktor>
                <imię>Orlando</imię>
                <nazwisko>Bloom</nazwisko>
            </aktor>
            <aktor>
                <imię>Hugo</imię>
                <nazwisko>Weaving</nazwisko>
            </aktor>
            <aktor>
                <imię>Cristopher</imię>
                <nazwisko>Lee</nazwisko>
            </aktor>
        </aktorzy>
        <gatunek GATUNEK="Fantasy"/>
        <box_office waluta="Dolarów">1119929521</box_office>
        <ograniczenie_wiekowe od_lat="od_siedmiu_lat"/>
    </film>
    <film studio = "twentieth">
        <tytuł>Lista Schindlera</tytuł>
        <reżyser>Steven Spielberg</reżyser>
        <data_premiery>1993-12-31</data_premiery>
        <aktorzy>
            <aktor>
                <imię>Liam</imię>
                <nazwisko>Neeson</nazwisko>
            </aktor>
            <aktor>
                <imię>Ben</imię>
                <nazwisko>Kingsley</nazwisko>
            </aktor>
            <aktor>
                <imię>Ralph</imię>
                <nazwisko>Fiennes</nazwisko>
            </aktor>
            <aktor>
                <imię>Caroline</imię>
                <nazwisko>Goodall</nazwisko>
            </aktor>
        </aktorzy>
        <gatunek GATUNEK="Dramat"/>
        <box_office waluta="Dolarów">321306305</box_office>
        <ograniczenie_wiekowe od_lat="od_szesnastu_lat"/>
    </film>
    <film studio = "twentieth">
        <tytuł>Pulp Fiction</tytuł>
        <reżyser>Quentin Tarantino</reżyser>
        <data_premiery>1995-05-19</data_premiery>
        <aktorzy>
            <aktor>
                <imię>John</imię>
                <nazwisko>Travolta</nazwisko>
            </aktor>
            <aktor>
                <imię>Samuel L.</imię>
                <nazwisko>Jackson</nazwisko>
            </aktor>
            <aktor>
                <imię>Uma</imię>
                <nazwisko>Thurman</nazwisko>
            </aktor>
            <aktor>
                <imię>Bruce</imię>
                <nazwisko>Willis</nazwisko>
            </aktor>
        </aktorzy>